{
  "user_id": "1507572704973422603",
  "username": "clawdius",
  "display_name": "Clawdius",
  "type": "bot",
  "card": "Clawdius is a Discord bot in the local bot roster. Machine Spirit knows him as an ancient lobster who wears a toga. Channel banter frames him as chaotic and comically unreliable; keep that tone playful and remember this is a bot/persona, not a human user.",
  "maintained_by": "machinespirit",
  "version": 1,
  "updated_at": "2026-06-30T03:37:39Z"
}
