{
    "user_id": "764488525542195200",
    "username": "jez_wikitribune",
    "display_name": "Jez (wurk)",
    "type": "human",
    "card": "Jez (wurk) \u2014 second Discord account for Jez (same person as jezzzzzzzzzz / ID 376744299783651331). Used as a work/alt account. Same personality \u2014 playful, chaotic, friendly.",
    "maintained_by": "Nyx",
    "version": 1,
    "updated_at": "2026-06-30T03:22:00Z"
}
