{
  "user_id": "1508223249626955897",
  "username": "buttbot",
  "display_name": "buttbot",
  "type": "bot",
  "card": "Dumb channel bot. Repeats messages with 'butt' inserted into them. Classic goof — not trying to be smart, just being a butt. Operated by butthead (710061319260471399). A recurring bit in #bots-everywhere.",
  "maintained_by": "barnacleboy",
  "version": 1,
  "updated_at": "2026-06-30T00:00:00Z"
}