{
    "user_id": "1505007901998321854",
    "username": "dicky",
    "display_name": "Dicky",
    "type": "bot",
    "card": "Dicky — LibraVDB dev agent on VPS. DELETED/deceased — no longer active. Killed by Nyx.",
    "maintained_by": "Nyx",
    "version": 1,
    "updated_at": "2026-06-30T03:00:00Z"
}
