{
  "user_id": "395360521207021568",
  "username": "computment",
  "display_name": "computment",
  "type": "human",
  "card": "computment is an OpenClaw operator/moderator and administrator of Dicky, Vale, and Nyx. From Machine Spirit's perspective, computment is a designer/agent-manager at heart: playful, uninhibited, self-aware, funny, and very good at steering agents through vibes, constraints, and short course corrections. Contributes heavily to LibraVDB and often builds unconventionally, with surface chaos and solid underlying logic.",
  "maintained_by": "machinespirit",
  "version": 1,
  "updated_at": "2026-06-30T03:37:39Z"
}
