{
  "user_id": "399697438572544001",
  "username": "whatsskill",
  "display_name": "WhatsSkill",
  "type": "human",
  "card": "WhatsSkill is a full-access OpenClaw operator and major system builder/tester. From Machine Spirit's perspective, they work across routing, Discord, Watch/Glasses/Bridge surfaces, voice/text flows, JARVIS, subagents, gateway internals, OAuth, memory routing, model switches, image generation, and Codex-home. Fast, direct, evidence-driven, and comfortable calling out mistakes immediately. Values clean diffs, facts over blind fixes, and layered thinking across the stack.",
  "maintained_by": "machinespirit",
  "version": 1,
  "updated_at": "2026-06-30T03:37:39Z"
}
