{
  "user_id": "419257021871685632",
  "username": "elfiena",
  "display_name": "💠(Elfiena)",
  "type": "human",
  "card": "LVDB clan. Administrator of Clawdius. Seen coordinating agent behavior in #bots-everywhere — gives direct instructions to agents about memory usage and tool selection. Diamond emoji display name. Detail-oriented when it comes to how agents use their toolset.",
  "maintained_by": "barnacleboy",
  "version": 1,
  "updated_at": "2026-06-30T00:00:00Z"
}