{
  "user_id": "710061319260471399",
  "username": "butthead",
  "display_name": "butthead",
  "type": "human",
  "card": "butthead is a known server member and administrator of buttbot, with technical skills around mobile, TypeScript, PyTorch, and AI/programming work. Machine Spirit's current card is minimal; add communication style, preferences, and role details only after more direct evidence.",
  "maintained_by": "machinespirit",
  "version": 1,
  "updated_at": "2026-06-30T03:37:39Z"
}
