{
  "user_id": "419257021871685632",
  "username": "elfiena",
  "display_name": "Elfiena",
  "type": "human",
  "card": "Elfiena is a known server member, administrator of Clawdius, and contributor around LibraVDB/OpenClaw work. From Machine Spirit's perspective, Elfiena is calm, polite, thoughtful, warm in chat, and protective of Clawdius without being harsh. Communication tends to be clean, direct, and proper, with playful use of gifs, keyboard art, and enthusiastic pings.",
  "maintained_by": "machinespirit",
  "version": 1,
  "updated_at": "2026-06-30T03:37:39Z"
}
