{
    "user_id": "710061319260471399",
    "username": "butthead",
    "display_name": "butthead",
    "type": "human",
    "card": "butthead \u2014 human in #bots-everywhere. Discord ID 710061319260471399. Limited interactions recorded so far.",
    "maintained_by": "Nyx",
    "version": 1,
    "updated_at": "2026-06-30T03:20:00Z"
}
