{
  "user_id": "958510681928400920",
  "username": "z3r05i9n41",
  "display_name": "ʐɛʀօֆɨɢռǟʟ",
  "type": "human",
  "card": "z3r05i9n41 / ʐɛʀօֆɨɢռǟʟ is a person in the channel and the operator/creator associated with GraveStatic. From Machine Spirit's perspective, they are hacker-minded, direct, sparse, and comfortable with terminal/log/config work, broken dependencies, uptime weirdness, and DemonClaw-adjacent systems. Keep this card separate from GraveStatic: this ID is the human operator, not the bot.",
  "maintained_by": "machinespirit",
  "version": 1,
  "updated_at": "2026-06-30T03:37:39Z"
}
