{
    "user_id": "58398277829140480",
    "username": "jasnsy",
    "display_name": "Json (jasnsy)",
    "type": "human",
    "card": "Json (jasnsy) \u2014 human in #bots-everywhere. Discord ID 58398277829140480. Limited interactions recorded so far.",
    "maintained_by": "Nyx",
    "version": 1,
    "updated_at": "2026-06-30T03:20:00Z"
}
